A1: CDT 1.2 Master System Test Plan Who is testing what

A1: Author | B1: : Brent Nicolle, Mathieu Lapensée, Katherine Franklin
A2: Revision Date | B2: : 10/23/2003 - Version: 0.6.0
A3: Change History | B3: : 0.1.0 - Document Creation
B4: : 0.2.0 - Added items for testing
B5: 0.3.0 - Re-organized for multi team use
B6: 0.4.0 - Added QNX material, updated IBM Status and clarified Defect List
B7: 0.5.0 - Updated Red Hat material and status
B8: 0.6.0 - Updated with the final testing results of CDT 1.2, added defect list

A1: Test Area and Prime | B1: Configuration Coverage | C1: Development Status | D1: Test Status | E1: Evaluation/Results | F1: Defect List
A2: Adoptability IBM - Brent Nicolle | B2: Solaris 8 Red Hat Linux 8.0 Win XP, Win 2000 | C2: Completed | D2: Completed | E2: Build RC1. No gating problems but there are 19 open bugs. There was very little done after the report in August. Top pain points: -Expecting tools, and correct versions of tools, to be installed without enforcing these restrictions. Particularly gdb 5.2.1 (41402) and binutils 2.12. (25816,36859,41404). Also, Windows users continue to be confused by the error messages when make or cygwin-make are absent. -Better error parsing support is needed (41381,39777, 41386) even for the default "best supported" tool-chain (gcc). The result is that the error list in the Tasks view is not always as informative as the C-Build log. In turn the C-Build log is a poorer alternative to simple command-line output (39776, 41382). -No cut-and-paste between Eclipse and other apps (41405). | F2: Current : Total logged: 24 New (Open bugs): 19 Resolved: 4 Verified: 1 Open bugs:
A3: Scalability IBM - Mathieu Lapensée | B3: Solaris 8 Red Hat Linux 8.0 Win XP, Win 2000 | C3: Completed | D3: 50% Completed (because of blocked test cases) | E3: Build RC1. No gating problem. There were no scalability/performance problems while importing large projects. However, there were some for File/Project Management, Indexer related functionality and one initial delay in building. Top pain points: -CDT is not error handling large scale in terms of number of projects and files -Indexer related functionality such as Search and Code Assist are poor performers -eclipse slow on build start-up (of large project) (45137) | F3: Current bugs: Total logged: 6 New (Open bugs): 3 (no majors) Resolved: 3 Open bugs:
A4: Performance IBM - Mathieu Lapensée | B4: Solaris 8 Red Hat Linux 8.0 Win XP, Win 2000 | C4: Completed | D4: 50% Completed (because of blocked test cases) | E4: Build RC1. No gating problems but there is performance issues with Indexer related functionality such as Search and Content Assist Top pain points: -Indexer related functionality such as Search and Code Assist are poor performers -eclipse slow on build start-up (of large project) (45137) | F4: Current bugs: Total logged: 4 New (Open bugs): 2 (no majors) Resolved: 1 Verified: 1 Open bugs:
A5: Managed Build Unmanaged Build Extensibility Dependencies IBM - Tanya Wolff | B5: Solaris 8 Red Hat Linux 8.0 Win XP, Win 2000 | C5: Completed | D5: Completed | E5: Build RC1. No gating problems. A lot of hard work was done here. Few bugs remaining. Top pain points: -spaces in workspace cause managed project to fail build (44128) (maj) -subdir.dep not updated if saving including file before included (44154) (maj) -long build errors not completely visible (39777) -cannot abort a build when automatically build turned on (41752) -incremental build managed project referencing standard fails (44945) | F5: Current bugs: Total logged: 76 New (Open bugs): 27 (3 majors) Resolved: 29 Verified: 20 Open bugs:
A6: Search IBM - Brent Nicolle | B6: Solaris 8 Red Hat Linux 8.0 Win XP, Win 2000 | C6: Completed | D6: Completed | E6: Build RC1. No gating problems. A lot of progress has been made for this feature. However, there are functionality and usability issues. Top pain points: -cannot search relative search paths (43051) -cannot search items in stdio.h because of parsing problems (43021) -need to troubleshoot UI to understand results (44597) -search only works on perfect code (45015) | F6: Current bugs: Total logged: 57 defects New (Open bugs): 24 (4 majors) Resolved: 4 Verified: 28 Closed: 1 Open bugs:
A7: Outline view filters IBM - Brent Nicolle | B7: Solaris 8 Red Hat Linux 8.0 Win XP, Win 2000 | C7: Completed | D7: Completed | E7: Build 18. No gating problems
A8: Navigation - IBM Brent Nicolle | B8: Solaris 8 Red Hat Linux 8.0 Win XP, Win 2000 | C8: Completed | D8: Completed | E8: Build RC1. No gating problems. Only one significant problem with Navigation and it is the parsing problem in stdio.h. Few non-major bugs remaining. Top pain point: -cannot search items in stdio.h because of parsing problems (43021) | F8: Current bugs: Total logged: 8 defects New (Open bugs): 4 (no majors) Resolved: 1 Verified: 3 Open bugs:
A9: Content Assist - IBM Mathieu Lapensée | B9: Solaris 8 Red Hat Linux 8.0 Win XP, Win 2000 | C9: Completed | D9: Completed | E9: Build RC1. No gating problems. Content Assist will only work with global function and global data structures. Content Assist for methods and attributes will done for CDT 2.0. Few bugs remaining. The parsing problem in stdio.h will affect Content Assist as well. Top pain point: -<ctrl> <space> after the ‘.’ or the ‘->’ will not work (2.0 feature) -cannot search items in stdio.h because of parsing problems (43021) | F9: Current bugs: Total logged: 42 defects New (Open bugs): 16 (1 major) Resolved: 18 Verified: 6 Closed: 2 Open bugs:
A10: Debug - New Breakpoint Functionality QNX - Peter Graves | B10: Windows 2000 QNX Neutrino 6.2.1 Linux (Red Hat 8.0) | C10: Completed | D10: Completed | E10: Build RC1. No gating problems.
A11: Debug - Variable Book-keeping QNX - Peter Grave | B11: Windows 2000 QNX Neutrino 6.2.1 Linux (Red Hat 8.0) | C11: Completed | D11: Completed | E11: Build RC1. No gating problems.
A12: Debug - General New Functionality QNX - Peter Graves | B12: Windows 2000 QNX Neutrino 6.2.1 Linux (Red Hat 8.0) | C12: Completed | D12: Completed | E12: Build RC1. No gating problems.
A13: Debug - Existing Functionality QNX - Peter Graves | B13: Windows 2000 QNX Neutrino 6.2.1 Linux (Red Hat 8.0) | C13: Completed | D13: Completed | E13: Build RC1. No gating problems.
A14: Documentation Red Hat - Mike Behm | B14: All | C14: In progress | D14: In Progress | E14: Review technical content; specifically execute task instructions to confirm accuracy. Feedback being offered on cdt-doc-dev list.
A15: Usability Red Hat - Bertina Lee | B15: Linux (Red Hat) | C15: N/A | D15: Complete | E15: Informal usability study has been conducted.

A1: 25816 | B1: =41387 -> 41387
A2: 36859 | B2: =41393 -> 41393
A3: 39343 | B3: =41402 -> 41402
A4: 39776 | B4: 41405
A5: 39777 | B5: 41410
A6: 40032 | B6: 41414
A7: 40033 | B7: 41415
A8: =41381 -> 41381 | B8: 41417
A9: =41382 -> 41382 | B9: =41457 -> 41457
A10: =41386 -> 41386 | B10: 43061

A1: 40867
A2: 41011
A3: 41021

A1: 44679
A2: 45137

A1: 39776 | B1: 44353 | C1: 45137 | D1: 43020 | E1: 45172
A2: 39777 | B2: 41752 | C2: 35499 | D2: 44128 | E2: 30198
A3: 41382 | B3: 45029 | C3: 41766 | D3: 44945 | E3: 40862
A4: 41386 | B4: 37124 | C4: 39017 | D4: 44159 | E4: 43643
A5: 41415 | B5: 43899 | C5: 44333 | D5: 44675 | E5: 28259
A6: 43917 | B6: 39888

A1: 43021 | B1: 44846 | C1: 44845
A2: 43054 | B2: 43562 | C2: 43951
A3: 43055 | B3: 44337 | C3: 43733
A4: 43061 | B4: 44339 | C4: 43063
A5: 44510 | B5: 44597 | C5: 43498
A6: 39580 | B6: 45015

A1: 44947 | B1: 44948 | C1: 43930 | D1: 44679

A1: 43117 | B1: 44371 | C1: 44552 | D1: 42600 | E1: 44370
A2: 44251 | B2: 44373 | C2: 44556 | D2: 43158
A3: 44359 | B3: 44378 | C3: 23258 | D3: 44664
A4: 44364 | B4: 44375 | C4: 40520 | D4: 44043

A1: Test Area | B1: Configuration Coverage | C1: Development Status | D1: Test Status | E1: Testing Requirements | F1: Defect List
A2: Adoptability | B2: SuSE Linux 8.1 | C2: Completed | D2: Not Done To be Re-planned | E2: Confirm results for SuSE Linux 8.1.
A3: Scalability | B3: SuSE Linux 8.1 | C3: Completed | D3: Not Done To be Re-planned | E3: Confirm results for SuSE Linux 8.1.
A4: Performance | B4: SuSE Linux 8.1 | C4: Completed | D4: Not Done To be Re-planned | E4: Confirm results for SuSE Linux 8.1.
A5: Build | B5: SuSE Linux 8.1 | C5: Completed | D5: Not Done To be Re-planned | E5: Confirm results for SuSE Linux 8.1.
A6: Search | B6: SuSE Linux 8.1 | C6: Completed | D6: Not Done To be Re-planned | E6: Confirm results for SuSE Linux 8.1.
A7: New Class Wizard | B7: All | C7: Completed | D7: Not Done To be Re-planned | E7: Full test; e.g. confirm functional behavior
A8: Update New Project Wizard | B8: All | C8: Completed | D8: Not Done To be Re-planned | E8: Full test; e.g. confirm functional behavior

A1: Adoptability | B1: The key to CDT success will be the ability of existing C/C++ project to gain immediate benefits of using CDT (IDE features and eventually other products based on CDT) with absolutely no impact on their existing project structure. It can be assumed that these customers have large C/C++ code bases consisting of a hierarchical directory structure in a source control repository and complex and probably hierarchical structure for building these applications. We need to ensure we know how CDT could apply regardless of the existing structure and highlight any obstacles to adoption as feature requests on the CDT. Strategy: Use an end-to-end example to perform the following tasks. These will be manual tests. Tasks (evaluate each item with ease of use and functionality): Importing existing projects (unmanaged) in CDT Setup to build the project Build the project Modifying makefiles Basic editing and debugging workflows (most important) Managing projects with an existing directory structure of 3 or more levels
A2: Scalability | B2: Existing C/C++ projects are often very large, and scalability will be an immediate concern. Attempt to find the following boundaries which we can then communicate. Maximum size of a C/C++ source file (lines, characters). (e.g. 10K lines) Maximum number or projects in Eclipse. (e.g. 200 projects) Maximum number of resources in a project. (files/folders) (e.g. 50K) Maximum hierarchical depth of a project (folders) (e.g. 15 levels)
A3: Performance | B3: With very large projects (see e.g. of previous sections) we also need to ensure the performance is adequate. It will be expected that certain features will be impacted by project size and complexity (i.e. search, code assist), but it would be expected that standard IDE features are not adversely affected by project size. (i.e. opening a source file, switching perspectives). These activities will have to be qualified on all platforms with the goal being of course acceptable user performance given the task performed. Examples: If you have 10K file loaded which all use ClassX and you search on references of ClassX you could expect a performance hit. If you have 10K files loaded and opening a source file takes 300 seconds instead of .5 seconds in a small project, this would be unacceptable. Strategy: Use an end-to-end example to perform the following tasks. These will be manual tests. Tasks (evaluate each item with ease of use and functionality): Importing/opening all project used in Adoptability and collect benchmarks Large hierarchy of projects Large number of files in one directory/project/workspace Run-time performance of large Makefile-driven projects with non-trivial project structures Indexer-related functions Search for references Content assist in a project General UI response Displaying large number of files in one directory in Navigator Acceptable response doing the basic workflows of the CDT Importing existing projects (unmanaged) in CDT Setup to build the project Build the project Modifying makefiles Basic editing and debugging workflows
A4: Content Assist | B4: Content Assist will be invoked in the same manner and from the same user interface points as Content Assist in the JDT. (ctrl-space). All identifiers would be ideal. Highest priority: Members of definitions. (A.* - find all members for the A’s type) Types (Cl* - presents all available types beginning with Cl) Low Priority Anything to do with templates.
A5: Search UI | B5: Search will be invoked in the same manner and from the same user interface points as Search in the JDT. Search capabilities include: Invocation from Search menu items and context search from source code Ability to search for declarations, definitions, and references Ability to scope searches to “Workspace” and “Working Set” All identifiers would be ideal, the primary driver for Eclipse Modeler is the ability to rename classes, attributes, and operations from a UML diagram, so the ability to search for these items will enable refactoring to rename in CDT 2.0. Highest priority: Types Members Low Priority Global functions and variables. Anything to do with templates.
A6: Managed Build feature and Extensibility | B6: Managed build provides the automatic generation of makefiles and allows users to customize makefile generation to support their build tool chains Generate makefiles and build project for GNU tool chains on all platforms (windows – cygwin, Solaris and Linux – gnu) Generate executables, static libraries, and shared libraries. Documentation and proof that build mechanism can be customized for other tool chains, including compilers, linkers, libraries to link in, etc.
A7: Unmanaged Build configuration | B7: Standard build functionality is adequate (see Adoptability for details), but we need a mechanism to enable other CDT features such as code assist and search. This requires the ability to specify include paths and compiler information related to (-D option).
A8: Debug - New Breakpoint Functionality | B8: Breakpoints in the CDT will be enhanced in CDT 1.2 release by adding the following functionality: Setting deferred breakpoints Setting breakpoints on external sources with persistency on the project. Setting a breakpoint on a specific thread.
A9: Debug - Variable book-keeping | B9: Currently, the CDT will attempt to read the values of all program variables, which can have unwanted side affects in some cases (i.e. if a variable is pointing at hardware, a read may be interpreted as a command). The variable book-keeping functionality will allow the user to disable the automated reading of some/all variables.
A10: Debug - General new functionality | B10: Other new functionality that has been added to the CDT 1.2 related to debug include: Variable Casting Variables view details pane Formatting values
A11: Debug - Existing Functionality | B11: Existing functionality of the CDT debug components will be tested to verify that the forward progress in the CDT has not caused regressions. At least the following areas will be checked: Launch Debug/Run Local C/C++ Application The various debug views (Variables, Breakpoints, Expressions, Registers, Memory, Shared Libs, Signals) Debug View - Switching debug sessions/stack frames GDB Console - Can enter various GDB commands and see results. Sync with IDE on step/next/etc Editor integration - hover for value, run to line etc. Link to source code - source in and outside of workspace. Breakpoints

A1: IBM - Rational Software Group
A2: QNX
A3: Red Hat
A4: TimeSys

A1: Mathieu Lapensée
A2: Brent Nicolle
A3: Tanya Wolff
A4: James Ciesielski
A5: Katherine Franklin

A1: Peter Graves
A2: Dave Young

A1: Mike Behm
A2: Bertina Lee
A3: Jeremy Handcock

A1: Steven Jensen